,author,disorder,text,totalwords,firstword
0,BetPuzzleheaded4080,bipolar disorder,If your mind is racing  does this cause you to become forgetful  Like more so than usual  Hypomania symptom,19,If
1,BetPuzzleheaded4080,bipolar disorder,Yesterday  I complained about feeling manic over that weekend  racing thoughts  wanting to move while not wanting to  a lot of ideas  too much energy with no where to go  Not sleeping too much and feeling restless/tired  This was after me taking meds for 5 days  Today  I didn t sleep too much like 5  but I usually sleep up to 8 9 to feel refreshed  So  I felt tired  but extra tired because I felt like I spent mental energy  I felt worn out all throughout work  Kinda spacing out at times  But  once I reached my house  I felt fine  I feel tired  but fine  Not too hyper at all  if anything maybe a little low  But  not enough where I even wanna complain  So  idk  Is it all just in my head,135,Yesterday
2,bipolarquickquestion,bipolar disorder,Hi all I'm diagnosed bipolar  don't know the type  following a cannabis induced episode of mania  amp  x200B When I was younger  up to maybe my twenties   life was very pleasurable for me  Especially music and everyday scenes/moods  empty streets and sunshine in the summer  watching landscapes while driving and listening to music  the first days of summer     I would listen to so much different music a lot of the time everyday and got great pleasure from it  would listen to songs again and again without loss of interest or pleasure  amp  x200B Through the years  my feelings of pleasure have diminished greatly  I very rarely feel the desire to listen to music and get a lot less pleasure from it  and even feel some sort of a negative feeling about most of the music I used to listen to  I don't get the pleasurable aesthetic feelings from every day life and scenes that I used to  either  if you know what I'm talking about    I also lost the desire to play video games  used to play and enjoy them a lot when younger   I generally also feel a lack of strong emotions  motivation  appreciation of beauty in nature or art  I've had two anguished/depressive episodes  one at 20 yo  the other at 27  I'm 33 now  I cannot tell if these episodes were the cause  or partial cause  of that loss of pleasure and passion  amp  x200B I would love to know if anyone can relate to my experience  If so  did you ever find anything that gave you back more feelings  emotions and pleasure   amp  x200B For me cannabis did that  subtly at first when I was smoking once in a while and then I went into a manic episode and I found my love of music again  maybe even stronger  Obviously  this isn't a reasonable solution  especially as this manic phase has been followed by a pretty severe depression that I am still currently suffering from  after 5 months of treatment  Does anyone else have flattened emotions and pleasure even outside of mood episodes,347,Hi
3,Numerous_Ad_6237,bipolar disorder,If someone with bipolar were to smoke weed on a regular basis would that cause more manic episodes  every time I stop smoking I feel like I m going insane not like withdrawals I ll just feel like I m slowly getting more and more insane but when I smoke I m never manic  Follow up on that question if someone with bipolar where to take psychedelics more than the average person would that cause problems in the future  Hypothetical Question,81,If
4,SnooDoughnuts8919,bipolar disorder,I've had these side effects on and off for the last 1 5 yrs and I've narrowed it down to decreasing lithium dose or occasional benadryl for sleep  I've taken benadryl for sleep off and on for about 10 years and used to take every night for   5 yrs before that with  no problems  Only other change is reducing lithium dose from 900 to 600/300 alternating  I occasionally forget to take it altogether  I haven't started to pay attention to how this correlates with timing of these awful episodes but I am going to start   Anyway  I feel extreme anxiety like nothing ever before  dysphoria  suicidal thoughts  paranoia  and weird general processing of my environment  everything looks dark and bleak and hopeless  I can't find any value in the world  Strangely it feels like it would if there were not many people left in the world and i wake up one day and my husband and son are gone  and my dog  and I live in this house alone  bleak  rundown  just way worse than Ive ever felt  I hope it's the lithium because I could do something about it  Until now it has just started without warning and lasts for days to a week   maybe the amount of time I am taking reduced doses of Lithium        Anyone else  reducing lithium extreme anxiety panic dysphoria,225,I've
5,manicscissorer,bipolar disorder,If so have you found them helpful  Positive/negative experiences  Have any of you guys ever used acetyl l Carnitine or rhodiola rosea,22,If
6,Phonburgundy1,bipolar disorder,I ve been diagnosed with bipolar disorder 2  I m tired all the time  I m extremely uneasy  I feel that my girlfriend doesn t respect me because of my constant depression  We don t have sex but I see her vibrator everywhere throughout the house  It puts me in a deeper depression because I feel like less of a man  I just completed my IOP program and I m ready to get another job  I have an interview with Apple this week so that s progress  I just hope I don t mess it up  Unfortunately  since I was sexually abused as a child  Sex is usually my go to  especially in a manic state  I have a new psychiatrist and I m looking for a new therapist but I can t find one to connect with  I m lost man  I don t have goals anymore  She rubs it in my face when I can t complete tasks  It feels like I m the guy in movie with the rat under his chef hat  This shit is controlling my every move  Will this ever stop  Will I be able to live a  normal  life anymore  Idk,198,I
7,aBirdwithNoName,bipolar disorder,i was trying to explain my sense of alienation to my therapist and came into a weird damn extended metaphor for it  maybe it'll help someone else in here feel a little less alienated as well so here's the thought we all need to drink to survive  some of us are raised drinking clean  nice water  some of us are raised drinking dish soap i hear you  dish soap is bad  you shouldn't be drinking it  but some of us really have no choice in the matter  we're born and our parents immediately begin mixing dish soap into our drinks  maybe we find some friends who let us have a taste of clear water and they help us realize that dish soap isn't how all water tastes  or maybe our grandparents give us a safe place away from drinking dish soap  maybe it's that our parents were raised drinking dish soap  too  and they were told it's just the way things are supposed to be  in any case  we're raised drinking dish soap this is a metaphor about suffering  by the way i was raised drinking dish soap from a very young age  my bipolar onset was likely due to a concussion i got when i was 2  distinct manic episodes were occurring by early grade school  complete with psychotic elements  i was told by my family that my experiences were normal  and dismissed again and again  taught that my emotions were the same as everyone else's  that my psychotic delusions were just my overactive imagination  that my mania was just me having a bad control over my temper  and so on and so forth  but we weren't talking about that  we're talking about drinking dish soap  that's what i mean when i mean dish soap  i have suffered illness from a very young age  and this is the soap  i know i just said the dish soap is suffering  it's also the suffering from the disorder  got it now  not all glasses of dish soap are the same  sometimes  the dish soap has water in it  sometimes the water is a higher percentage than the dish soap  sometimes worse  when things are at their worst  i'm drinking pure  undiluted dish soap  when they're at their best  i'd say maybe it's about 20  dish soap  80  water  so i've experienced some pretty low doses of dish soap at times  as i've gotten older  i've found more people to pour water into my glass and displace the dish soap  so it's a smaller and smaller percentage over the years  these people are my lover  my friends  the people who have supported me and made my life easier  they understand that i drink dish soap  and that they can't just give me a new glass  this is the only glass i'll ever had  but they can pour good things in and it'll force the dish soap out my friends and loved ones understand what i mean when they see me drinking dish soap  but not always  and not everyone understands  and this is where the alienation comes in  and why this is a metaphor  because it helped me explain a complicated issue not everyone views my cup of dish soap the same way i was raised drinking pure  undiluted dish soap  so when my friends and loved ones pour water in  and i'm only drinking 20  dish soap  it's the clearest  most refreshing glass of water that i've ever tasted  i feel relieved and happy to be drinking 80  water  if i'm drinking pure dish soap  i hate it  and i might reach out to people for help and get some water in there  if i'm drinking 50  dish soap  it may be unpleasant but maybe to me  it's still acceptable  i tolerate it  my happiest is when i'm drinking 20  dish soap  to me  that's as good as it gets sometimes  i talk to somebody who's been raised drinking clear water  or has only ever had dish soap a few times in their life  i will be telling them about my 20  dish soap days with a smile on my face  telling them how happy i was to have 80  water to drink  they react with visceral disgust  hearing that i was drinking 20  dish soap  not seeing the water that i'm talking about  i keep telling people stories of my life thinking that they'll find them funny or enjoyable  and instead i find myself being pitied by people over things that i viewed as a positive  the days that i thought were my happiest  my best  to people who have never had dish soap  20  seems like a fate worse than death my partner drinks dish soap too  it's true  he suffers from unipolar depression and has been given a fair amount of dish soap in his life  but it must not taste the same as the dish soap i'm drinking  because even though i know he's never had clean water either  he still reacts with shock and pity sometimes when i tell him about what i'm drinking  i try to tell him something about my life and he reacts with surprise  hurt and upset for me that i've suffered so much  but i was telling him about a day where i had 75  water and it was actually a pretty good day  he nervously pours more of his own water into my cup  draining it from himself because he's worried about all the dish soap i've been drinking  and he wants to help  i love him to bits  but sometimes even he doesn't understand if i'm telling him a happy story  because he's so busy seeing the ways that i've suffered  sometimes  i tell people i'm drinking dish soap and they tell me i'm lying  that it's just water  nobody could actually survive drinking dish soap for so long  i'd be dead and in hell by now if i was really drinking dish soap  they don't believe me about the extent of my illness  they tell me that if i was really that bad  i'd have committed suicide already or been permanently institutionalized  they don't understand that lobsters can sit in the water until they boil sometimes  i tell people about the 80  water days and they pity me so deeply  it becomes difficult to talk about anymore  my best days  my happiest moments  get sullied by the way that people react to them with horror  they never grew up drinking dish soap  and think that any dish soap at all is a fate worse than death and at the end of it all  it's not about dish soap  it's about alienation about the times that i've told people stories about my life and they were so wrapped up in pity about how pathetic and sad my life must be living with bipolar disorder  that they don't see my joy  they don't see that i'm a person who can experience happiness on good days i went to graduate school in another state  years ago  the program was the first time i'd lived that far away from my abusive family  and it exposed me to so many new views  new experiences  new people  i learned that my new favorite food was the buttercream cupcakes i got at the market near my apartment  and that i liked to listen to music and dance while i was cooking  i discovered that i enjoyed my own company  and that i enjoyed the company of others as long as they were people i could trust  i got to experience so many things that i never would have experienced otherwise ultimately  after 1 semester  i was removed from the program for being transgender  a few months later  i had to move back home  back into the abuse  because i could not afford to stay out there without student loans to help support my housing  to this day  i still consider those months that i spent in another state as the best time of my life  but when i tell people about it  they only hear about how i was removed from grad school for being trans  they don't hear about the trans woman i met in a bookstore who was the first other trans person i'd met who was actually older than me  and gave me hope there was a future for me  they don't hear about the fact i got to hold famous books from the 1500s and that it permanently inspired the way that i approach my art  vesalius is super cool if you've never seen the art   they don't hear that i took a class that taught me how to make paper  and that i learned that my passion in life is to make zines and booklets and share art and creativity with other people  they don't hear about the stuff that i loved  that made my life better when i tell people about it  they hear only the bad  and they input their own opinions onto my experience  and tell me that it was horrible  they pity me  tell me i never should've had to experience it  that i should've been able to just stay home and never gone to grad school in the first place and i don't disagree that things shouldn't have ended that way  unfortunately that's not a state where it's illegal to bar someone from a school program for being transgender  i moved back to chicago where i'm in a protected minority class  and i don't intend to leave the state again  but when i was out there    there was no recourse for what happened to me  and i do have my anger and frustration about it  of course  but i also overwhelmingly still see that period of my life as a positive but when i tell people  they only see the negative they only see the dish soap  and they don't see the water  i think  for a bit  i only had 10  dish soap  and i really felt that someday i'd have my first taste of clear water  it gave me hope  it gave me joy  and everyone else just sees dish soap  they pity me so much for the dish soap that they make me feel strange talking about my happiest days  as though my joy was not and should not have been real  i slowly get quieter and withdraw because nobody can understand how happy i was drinking 90  water  when they only see that i was drinking 10  dish soap  it was the best time in my life and maybe people treat you the same way  they shut you down when you talk about your happiness  because it's not the right kind of happiness for you  they pity you  they see you as your suffering before they see you as a person  it's deeply fucking alienating but you're not the only one drinking dish soap  and you aren't alone so for everyone out there whose best days still look sad and pitiable to everyone else  you aren't alone  you're not the only one drinking dish soap out there  and i understand how wonderful those days are when the cup is 80  water  alienation and dish soap,1874,i
8,echinaceabloom1,bipolar disorder,i continuously make horrible decisions SO impulsively and it makes my mental health so much worse and it sucks because i dont even have an excuse i m the one making the decisions  i m feeling really hopeless right now because i m just stuck in the self destructive cycle  impulsive bad decisions are killing me,56,i
9,Destroyedmywholelife,bipolar disorder,Are you alone  I am  I don't and actually refuse to socialize and deal with people  It's been years that i don't have friends and I've been traveling alone this world  i feel like i don't want to have a relationship  friends or even kids  I'm a 27 year old man btw and i enjoy and love myself very much  while thinking about people's feelings or opinions just bothers me and stresses me out a lot  I don't know   maybe I'm crazy or whatever but i want to know if this attitude is related to my bipolar disorder  Anybody here  I think at this point not socializing is part of my bipolar disorder,113,Are
10,thewaymylifegoes,depression,He  22M  dumped me  22F  a week ago  said he didn t want me  we dated for a year  I posted an instagram story today of my dead grandfather  he DM d me  I hope your doing well  What is going through his head  Why would he do this to me  He promised he would stop contacting me as I mentioned it hurts to receive contact and I can t move on if he keeps reaching out  What is wrong with him  Why does he do this  Original breakup story  https //www reddit com/r/pnsd/comments/wvvnxv/bf _22m _dumped _me _22f _then _said _he _already _moved/ utm _source share amp utm _medium ios _app amp utm _name iossmf  https //www reddit com/r/pnsd/comments/wvvnxv/bf_22m_dumped_me_22f_then_said_he_already_moved/ utm_source share amp utm_medium ios_app amp utm_name iossmf  Ex Dumped Me Then DM'd Me,133,He
11,RiceCrisp1es,depression,I'm a teenager living at home and have been depressed for the majority of my life  I have always struggled to feed myself and its only gotten worse as has my depression  I'm at a point where I can barely eat  I don't have the money to buy my own food and my parents won't buy most  easy  foods because they think it's a waste of money and if they do buy it they guilt trip me and I end up not eating as self punishment  I am a bit of a picky eater  I would never complain about food made for me but if I don't like something I just won't eat Bit rambly but in short I have little access to freezer or instant food  rarely have the energy for basic food prep  will usually go hungry instead of eating something I don't like  How do I feed myself with all of this  I struggle with restrictive and binge eating and really feel stuck eating toast every day  how to eat,173,I'm
12,Big_Park_4300,depression,Please I want to ask if there are any users here who've had experience with or know about psilocybin and it's uses to treat various mental issues  How credible is this  I've heard so much about it and haven't really thought to look up about it till now  Has anyone used it with positive results  I would like to know your thoughts in the comments Seeking  Advice on use of Psilocybin,71,Please
13,Micahiscoo,depression,Everyday she  18f  tells me  17m  the most worrying stuff and it breaks me cause she always just  I m fine   I m just overreacting like always  I know therapy might not be for everyone  but she needs it so bad  she was suicidal for 2 years and probably still is  and is severely depressed yet she can never say she isn t ok  It breaks me everyday she says something then just puts  lol  or    It seriously breaks me  she s my best friend and I care for her so much  and her not even being able to talk about the simple things always hurts  she s been more closed off than ever recently  and it makes me worry so much Is it mean to say I can t talk until she s ready to have this type of convo  Even tho they aren t fun  they are so important  I feel like she texts me out of pity everyday because she NEVER had something to talk about  she says hi and expects me to carry the convo on Thank you for anyone is advance TL DR title  Is it mean to say I won t be able to talk to my friend until their willing to admit they aren t ok,213,Everyday
14,atoflare1010,depression,first time posting here  on mobile The title says it all  I need help to stop crying all the time  It's bad to the point people think I weaponise crying to be manipulative  While in fact  it's just that I cannot contain my emotions at all  I don't wish for people to pity me  I've made countless promises about stopping to cry  but I just cannot do it  I honestly now believe that I am indeed manipulative  even not on purpose I truly hate myself for not being able to regulate my emotions and feelings  I feel inadequate  replaceable and abusive  I struggle with interpersonal relationships very badly  and I ruin everything in other people's life  because I'm insecure  I'm desperate to save everything I can  but I just cannot stop myself from crying and being manipulative I need help  please  I want to stop being abusive  need help to control emotions  stop crying and stop being insecure,158,first
15,thotslayer3000001,depression,For a couple days I ve been doing pretty good but right now I got my period and we don t have any tampons or anything like that we don t even have any toilet paper   I could take bugs living in our house and living with hoarders    but  there s only so much I can put up with  I can t take my family I just want a normal fucking life  I don t fucking deserve this  I just want to leave  My life can t get any more lower then this  I m so alone There s only so much I can take,105,For
16,MatMat_0,depression,Another post almost nobody will read This is my last attempt to get better  As I said in my last post I'm just done with everything   You don't gotta read it but basically I've tried everything but nothings really worked I'm 99  sure my depression is because of my obsession with a girl  If I can beat this obsession I think I can beat my depression as well  I think about her all the time  pretty much all my actions are influenced by her  and it just feels like my life and thoughts are just all about her I need to know how to stop an obsession  I'm currently friends with the girl tho and I have no intention of leaving her  I'm pretty much her only friend at school and I'm not abandoning her  So I know everyone is gonna say to just stop talking to her  but if that's the case don't bother  I'm sorry but I'm not doing that If this doesn't work I'll probably try medication  But I already know that won't work either  This will probably be one of my last posts on here  If none of this works I'm ending it  I might post if I do end up beating this  or at least make a little progress  But I don't think I'm capable of being helped  so as I said before this will probably be my last post  If you read this far  thanks for caring even the slightest bit my final attempt,250,Another
17,Barbie-Girl5682,depression,I often wish I could truly be happy and find the right person for me I know no person can make me happy or take my depression away but I feel like if I had someone to talk to all the time my depression wouldn't be so bad all the time,51,I
18,Wonderful-Parsnip-79,depression,I'm starting my job on the 6th  I've been stretching every night and morning so that I can feel less physical pain  and I've been going on walks with friends or biking every day for the past 3 days straight  It doesn't feel like a long time  but it's a long time for me in terms of sticking to habits This feels great  but my depression is preventing me from feeling the impact of my achievements  I still feel so numb and irritated  and I've been rude to people around me because I'm mentally unwell  Does anyone have any tips  Sometimes I convince myself everyone hates me  but I've been trying to counter that  Despite everything  it still feels terrible to be alive  Thank you  My life is going great  but I still feel pretty depressed  Any tips,138,I'm
