,author,disorder,text,totalwords,firstword
19,MountainGerman,depression,For context  I'm legally blind  hard of hearing  and on the spectrum  I live off of disability  I originally posted this on another subreddit but just discovered this one and I hope that someone might be able to offer some insight or advice  Or support  I'm just so tired right now  Being on disability has been a blessing and a curse for me  It's been a blessing because I now have a means by which to support myself and my daughter  I was born disabled  but didn't actually get on disability until adulthood and didn't work enough to get SSDI  so I rely solely on SSI and make the money stretch as much as I can by living with my parents   But it has also been a curse  because as I'm sure you all know  being disabled doesn't come with much money or resources  on top of the inherent restrictions one has due to their respective disabilities I spend the vast majority of my time alone  My parents both work  and my daughter is in school  I do have a couple of friends that I see on occasion  one on a weekly basis  So I have more time than I know what to do with  But having all this time alone has been a recipe for disaster for me  I'm extremely depressed and socially isolated  When I try to do things that I love  like reading  I love learning and studying various histories  or writing  creative outlet   I just can't seem to escape this horrible feeling that it's all pointless  Like  sure  I can read about the Thirty Years' War or get lost in books about my Faith  Eastern Orthodox  or other subjects I love  likelearninglanguages  too   but since I have no way to put my knowledge/hobbies to use  it all feels like just a sad waste of effort that will never amount to anything  I would love to be able to be involved with my hobbies/interests and share them with others  but I just can't think of how that could be done  Some of my interests are incredibly niche/specific  and the area I live in is fairly rural and not exactly full of diverse opportunities  I'd love to take classes  but have no idea where to begin on that as student loans are out of the question  And while I wouldn t be opposed to online courses  I once again run into the problem of not being able to use/share myself/my knowledge  as well as not knowing where to begin in searching for an online course or tutor  I want so desperately to be able to grow and thrive in my interests  but financial and transportation limitations on top of everything else just throttles my passion  and I don't know what to do anymore  Is anyone here aware of online courses/tutors/groups that could help me  Can anyone relate to this  I'm so tired of being stagnant  People have told me how jealous they are of how much time I have available to myself and that makes me feel even worse  because not only did I not ask to be disabled  but it makes me feel like I'm somehow being disabled the  wrong  way because they seem to know exactly what they would do to enjoy the endless time  I would love nothing more than to enjoy it I would love nothing more than to be useful  It's just really hard and I can't figure out what to do or where to go  Any and all advice would be wonderful  even if just to say that you relate and I'm not alone with these feelings/thoughts  Unlimited time  but no direction  Advice/Support appreciated/needed,612,For
20,Square_Ad4463,OCD,I was just recently diagnosed with OCD  One of my themes is fearing being perceived as racist and/or being shunned by others because they perceive me as problematic  My obsession has largely been about accidentally doing something racist until recently  when I remembered something racist I did when I was 14 or 15  I tweeted a joke that had the n word in it  I was not using the word in a hateful way  but basically as a replacement for the word  guy  in the joke  Still  I am white  and it's such a hateful  violent word when used by someone who is white  I got called out immediately by some acquaintances of mine who were black and I deleted it almost as soon as I posted it  It was the only time I've said the word  and I've never said it since  but I still obsess about that moment  I feel so guilty  like I should avoid being around POC to avoid accidentally subjecting them to racism  I look at other white people and feel like they probably haven't done things as bad as this  so they deserve to be happy  and I don't  It must be so horrible to grow up around white people as a black person and hear them test out using a slur like that around you  and I feel so ashamed to have participated in that  Selfishly  too  I obsess about being rejected by others because of it  Even though no one has ever brought this event up to me  I worry about it being  exposed   or I wonder if someone took a screenshot of my tweet  I have this feeling that eventually I will be found out and my relationships/career/life will be torpedoed  I know that this is just my OCD talking  and the reality is that if it ever came up  some people would criticize me  which they would have a right to  and others wouldn't and eventually we would all move on  Can I get some advice on what to do and how to feel better  Nothing seems to relieve my guilt  Real event OCD and racism,356,I
21,jaypawwww,OCD,Hey all  I have been struggling with OCD and on and off themes since I was 8  This year in particular has been terrible  as I have been jumping from theme to theme since February  The longest break I d gotten was probably about a few weeks before another theme started I just recently recovered from a particularly bad theme and I was doing great for like 2 weeks  However  last night I started fearing that I had BPD  I looked at the diagnostic criteria and I feel like I  could  just barely make it into a diagnosis  My biggest concern  and the theme that the OCD is focusing on right now  is the  lack of identity   I don t think that I have a lack of identity  i feel extremely in touch with my personality  my humor  my values  my appearance etc  However  when it comes to hobbies  I feel like there is where I could apply that BPD symptom  I used to have my own hobbies as a child  and I was a loner with no friends and I was happy about it  As I became a teen  I started befriending new people and I realized how far behind I was  I knew nothing about pop culture  or anything that my peers were into  I mostly loved fictional books and legos and science  From there  I started a terrible habit  I practically force myself into interests to fit in with a particular group  It s always the same group but I have so much distress and anxiety surrounding it  The worst part is that I actually think these hobbies and interests are cool and fun  but because I have so much anxiety surrounding them  I just feel anxiety and dread when participating in them  I feel like a fraud  like my whole identity is fake  But by identity  i mostly just mean hobbies  Not my actual self and personality  that s always remained purely me  I also have severe anxious attachment  and when I get attached to one person  currently my significant other   I become practically obsessed and terrified of them leaving  so i try to force myself into their interests  But I genuinely come to like these interests  not all of course  and I never force myself into something I just hate   except when I feel so much dread about starting it because it  doesn t feel right   I can t start a new show until it feels like the  right  moment and it s weighing on me so much because it carries into every aspect of my life  including homework  gaming  cleaning  fitness  everything  This is currently making me panic because I am terrified that I have BPD  What s freaking me out at the moment is the prospect that my whole identity is fake and that one day I will crumble and lose myself and not know what to do  I m so scared  I just need a bit of support right now please  Weird new theme that I am trying to deter before it truly settles in,513,Hey
22,cailinob18,OCD,I m OCD and have emetophobia  sp    I have had TONS of obsessions over the years  but chief among them has always been gross things/ pathogens/poisons getting into my environment and body  As a result  I m petrified of roaches  When I find one inside the house  I basically turn into a zombie for several hours after  I can t function   My OCD was doing really well  I m even weening off Paxil  down to 10 mgs    But then we moved into a new house about a month ago and guess what it had waiting for me   A roach infestation   12 sightings this week alone  They come out to terrorize me at night  so I barely sleep  One ran across my feet in the bathroom a while ago  so I ve stopped being comfortable in there and as such haven t been showering or tending to my hygiene like I usually would  I m usually a skincare  teeth whitening  shower every day and moisturize girly   now I m lucky if I brush my teeth and wash my face   Probably the worst is that I am finding it VERY hard to eat in the house  I m just too grossed out and anxious  This is bad  because my OCD has been contributing to a lot of disordered eating and food restricting in recent years  I was finally getting that under control before this  Even worse  we re renting  So we have to ask my landlord to send out pest control  fill in cracks in the walls where roaches are probably coming from  etc  it s sending me into actual tantrums that I have to be on his slow  lazy timeline when I literally feel like I m going crazy in his house  Last time it took him a week to send out pest control  I ve even talked to my husband about breaking the lease and just leaving  Any support appreciated  I just feel so down  tired and disgusted  I want a place to feel comfortable in again  r/ocd Roaches in my new house have triggered my OCD badly and now I can barely eat or sleep here,357,I
23,Separate_Tangelo7138,OCD,I have to plan to leave ahead of time because it takes me an extra 10  minutes to check that I haven t left candles  coffee maker  oven  etc on several times before I leave  I have a terrible fear of my house catching fire when I leave  This obsessive fear was intensified 100000 fold after I caused an accidental fire in my yard   Nobody got hurt  but it was terrifying Even if I know I haven t lit a candle that day I think  Did I light one and forget   And check all the candles often more than once  Sometimes I finally get out the door and I feel like there s something I forgot to check  go back up and check again  Once I get in the car or to my destination I m obsessing in my head like  did I turn ___ off  Did I turn ___ off   imagining my house on fire and what not MAN is it exhausting  Often times I avoid using the oven or candles or anything when my boyfriend isn t home just to avoid the stress  Does anyone else take forever to leave the house because of checking things,198,I
24,Grudagreat,OCD,For example I was born on January 19  When I went on futurescopeastrology to read about my personality it literally described everything I am going through  like constantly doubting and fighting with my inner fears  Can anyone relate or am I tripping  Does your birthday determine whether you have OCD,50,For
25,SweetKanara,OCD,I ve known for a while I suffer from anxiety but I worry that this might have developed  or stemmed from perhaps  OCD  Since I was conscious  I always had a obsession with hand washing which has only gotten worse resulting in me having to frequently moisturise otherwise my hands suffer from severe pain  blisters  sensitivity etc  I ve also always struggled with toilet hygiene  I used to be scared of going to the toilet due to contamination which nowadays manifests in severe worries about things like bleeding  urine colour and more  Furthermore  I ve always been worried about sexual health  I thoroughly clean and the slightest bump sends me into a panic  There s a laundry lists of other examples but these are just some  I m not an expert  I did some research but couldn t find anything conclusive  Should I look at getting tested or something  Maybe see a psychologist  Thank you in advance    Started to consider I might have OCD but I m not sure,169,I
26,Purple_Feeling_186,OCD,I know this is irrational fear but is getting small amounts bleach on your skin harmful to your skin long term  I mean all i did was touch the bleach bottle  I washed my hands afterwards but my brain was still like  oh no  you have bleach all over you and it s going to burn your skin  and it got to the point where everything i was touching became contaminated with bleach   I know I ve already talked about this but it s always something different  last time it was soap and now it is bleach  You don t have to respond but please be kind  i would just like to know is any chemical  toxic  in small amounts or even big harmful to skin long term  Even if you wash it off  Bleach and other chemicals,138,I
27,Bored-Giraffe,OCD,Is it normal to be curious about what my therapy notes say  Is it normal to be curious about what my therapy notes say,24,Is
28,Safe-Piano6208,OCD,Hey guys  I ve had ocd now for about 6 years now and have has basically every obsession you can have  some lasting longer than others  At the minute  I have one about my body  I find myself body checking a lot during the day  seeing bow my clothes fit  watching my calories  I am heavier than usual atm but am joining a gym class that will help  However  my anxiety revolves around me being obsesssed with how I look and developing an eating disorder that will ruin my life  Itlll be like I m going on a walk or a workout and my brain will be like  youre addicted to exercise  you re only doing this to punish yourself  and it really messes with me  Has ano time been through this and any tips on how to manage  Thank you  Obsession about my body and worried about having an eating disorder,152,Hey
29,cdiggydawg,OCD,Has anyone tried inositol for their ocd and if so what were your results  Thank you inositol,17,Has
30,unsocial_moth,schizophrenia,AI generated art that I made  What do do think,10,AI
31,Khailast,schizophrenia,Gods or higher beings demons or spiritual forces of a higher dimension have chosen certain people for communication the government try s to put us on meds to silence our intelligent thoughts bcs they are scared we will rise above them with the gift we have been given  what do you guys think  Gods or higher beings and how they are connected to us,64,Gods
32,hatezips,schizophrenia,Do you think it's reliable,5,Do
33,Pretend_Delivery5913,schizophrenia,I was initially diagnosed with psychosis nos when I was 16  later on schizoaffective  I have comorbid ptsd and lately my psychiatrist has been acting really rude  condescending  and makes a nasty look everytime I tell her anything  I feel really disrespected after each visit  I was explaining having hallucinations and feeling detached which is the usual for my episodes  She instantly made a cold  skeptical face and said detached  Like how  Then changed the subject entirely almost with a sigh when I mentioned hallucinating  Everything is being called ptsd related at this point  and I know I have not been misdiagnosed  I don't know what to do or how to talk to her without getting angry  Psychiatrist is acting like I am faking  says I've been misdiagnosed,128,I
34,Prestigious-Ad-5461,schizophrenia,I am trying to see if singing bowls would be good for my diagnosis  Anyone use them  Are singing bowls good for psychosis diagnosis or bad,26,I
35,Candid-Trip1975,schizophrenia,i was on risperidone for a about a year  i started at 175lbs and weighed about 300lbs when i got off my doctor didn t listen when i told her the weight gain was extreme even though she saw it  they weighed me at every appointment and it was drastically going up  i took it upon myself to take myself off  i am since down to 215lbs  i got a new physiatrist and today she prescribed me abilify followed with the buspirone and imiprimine i was already on  i found myself over researching because i fear extreme weight gain  and all i m seeing is negative things  did anyone have any luck at all without weight gain  im so scared  sorry for spelling errors  im a mess right now  Prescribed abilify,131,i
36,14footbadger,schizophrenia,I forgot to add in my last post about this episode    the fear    I think disney wants to pop my organs    What kind of things from your episodes put you in a state of fear  the fear,37,I
